{
  "$schema": "https://json-schema.org/draft/2020-12/schema",
  "title": "rackcad-i64-conformance-review/v1",
  "type": "object",
  "additionalProperties": false,
  "properties": {
    "Schema": {
      "type": "string",
      "enum": [
        "rackcad-i64-conformance-review/v1"
      ]
    },
    "RunId": {
      "type": "string",
      "enum": [
        "R20261010T012851Z-de0d"
      ]
    },
    "ReviewSubject": {
      "type": "object",
      "additionalProperties": false,
      "properties": {
        "Commit": {
          "type": "string",
          "pattern": "^[0-9a-f]{40}$"
        },
        "Amendment": {
          "type": "object",
          "additionalProperties": false,
          "properties": {
            "Path": {
              "type": "string"
            },
            "Blob": {
              "type": "string",
              "pattern": "^[0-9a-f]{40}$"
            }
          },
          "required": [
            "Path",
            "Blob"
          ]
        },
        "Verifier": {
          "type": "object",
          "additionalProperties": false,
          "properties": {
            "Path": {
              "type": "string"
            },
            "Blob": {
              "type": "string",
              "pattern": "^[0-9a-f]{40}$"
            }
          },
          "required": [
            "Path",
            "Blob"
          ]
        },
        "SelfTest": {
          "type": "object",
          "additionalProperties": false,
          "properties": {
            "Path": {
              "type": "string"
            },
            "Blob": {
              "type": "string",
              "pattern": "^[0-9a-f]{40}$"
            }
          },
          "required": [
            "Path",
            "Blob"
          ]
        },
        "SelfTestResult": {
          "type": "object",
          "additionalProperties": false,
          "properties": {
            "Path": {
              "type": "string"
            },
            "Blob": {
              "type": "string",
              "pattern": "^[0-9a-f]{40}$"
            }
          },
          "required": [
            "Path",
            "Blob"
          ]
        }
      },
      "required": [
        "Commit",
        "Amendment",
        "Verifier",
        "SelfTest",
        "SelfTestResult"
      ]
    },
    "Topics": {
      "type": "object",
      "additionalProperties": false,
      "properties": {
        "AuthorityAndMateriality": {
          "type": "object",
          "additionalProperties": false,
          "properties": {
            "Result": {
              "type": "string",
              "enum": [
                "CONFORMING",
                "NON_CONFORMING"
              ]
            },
            "Evidence": {
              "type": "string"
            }
          },
          "required": [
            "Result",
            "Evidence"
          ]
        },
        "ScopeInvariantPreserved": {
          "type": "object",
          "additionalProperties": false,
          "properties": {
            "Result": {
              "type": "string",
              "enum": [
                "CONFORMING",
                "NON_CONFORMING"
              ]
            },
            "Evidence": {
              "type": "string"
            }
          },
          "required": [
            "Result",
            "Evidence"
          ]
        },
        "FailOpenRoutes": {
          "type": "object",
          "additionalProperties": false,
          "properties": {
            "Result": {
              "type": "string",
              "enum": [
                "CONFORMING",
                "NON_CONFORMING"
              ]
            },
            "Evidence": {
              "type": "string"
            }
          },
          "required": [
            "Result",
            "Evidence"
          ]
        },
        "HistoricalNc2RemainsFail": {
          "type": "object",
          "additionalProperties": false,
          "properties": {
            "Result": {
              "type": "string",
              "enum": [
                "CONFORMING",
                "NON_CONFORMING"
              ]
            },
            "Evidence": {
              "type": "string"
            }
          },
          "required": [
            "Result",
            "Evidence"
          ]
        },
        "NoI61OrI62NormativeChange": {
          "type": "object",
          "additionalProperties": false,
          "properties": {
            "Result": {
              "type": "string",
              "enum": [
                "CONFORMING",
                "NON_CONFORMING"
              ]
            },
            "Evidence": {
              "type": "string"
            }
          },
          "required": [
            "Result",
            "Evidence"
          ]
        },
        "FutureUseStrictlyScoped": {
          "type": "object",
          "additionalProperties": false,
          "properties": {
            "Result": {
              "type": "string",
              "enum": [
                "CONFORMING",
                "NON_CONFORMING"
              ]
            },
            "Evidence": {
              "type": "string"
            }
          },
          "required": [
            "Result",
            "Evidence"
          ]
        }
      },
      "required": [
        "AuthorityAndMateriality",
        "ScopeInvariantPreserved",
        "FailOpenRoutes",
        "HistoricalNc2RemainsFail",
        "NoI61OrI62NormativeChange",
        "FutureUseStrictlyScoped"
      ]
    },
    "Findings": {
      "type": "array",
      "items": {
        "type": "object",
        "additionalProperties": false,
        "properties": {
          "Id": {
            "type": "string"
          },
          "Severity": {
            "type": "string",
            "enum": [
              "REQUIRED",
              "OPTIONAL"
            ]
          },
          "Topic": {
            "type": "string",
            "enum": [
              "AuthorityAndMateriality",
              "ScopeInvariantPreserved",
              "FailOpenRoutes",
              "HistoricalNc2RemainsFail",
              "NoI61OrI62NormativeChange",
              "FutureUseStrictlyScoped"
            ]
          },
          "Location": {
            "type": "string"
          },
          "Defect": {
            "type": "string"
          },
          "Authority": {
            "type": "string"
          },
          "Correction": {
            "type": "string"
          }
        },
        "required": [
          "Id",
          "Severity",
          "Topic",
          "Location",
          "Defect",
          "Authority",
          "Correction"
        ]
      }
    },
    "RequiredCount": {
      "type": "integer",
      "minimum": 0
    },
    "Verdict": {
      "type": "string",
      "enum": [
        "AGREED",
        "CHANGES_REQUIRED"
      ]
    },
    "Conformance": {
      "type": "string",
      "enum": [
        "CONFORMING",
        "NON_CONFORMING"
      ]
    },
    "Limitations": {
      "type": "array",
      "items": {
        "type": "string"
      }
    }
  },
  "required": [
    "Schema",
    "RunId",
    "ReviewSubject",
    "Topics",
    "Findings",
    "RequiredCount",
    "Verdict",
    "Conformance",
    "Limitations"
  ]
}
